rank,PCI,category
1,3.896333340424657,Futuristic Design Award Category.
2,3.896333340424657,Prosumer Products, Tools, and Machinery Design Award Category.
3,3.896333340424657,Luxury Design Award Category.
4,3.896333340424657,Vehicle Parts, Auto Accessories and Care Products Design Award Category.
5,1.9996270079968885,Landscape Planning and Garden Design Award Category.
6,1.7696871826616103,Performing Arts, Style and Scenery Design Award Category.
7,1.3475444233633547,Construction and Real Estate Projects Design Award Category.
8,1.0721521199768898,Interior Space and Exhibition Design Award Category.
9,0.9857440506025835,Urban Planning and Urban Design Award Category.
10,0.9536048665711289,Heating, Ventilation, and Air Conditioning Products Design Award Category.
11,0.8433645363352935,Beauty, Personal Care and Cosmetic Products Design Award Category.
12,0.7104544935193303,Robotics, Automaton and Automation Design Award Category.
13,0.6886196445708985,Energy Products, Projects and Devices Design Award Category.
14,0.6847064330976509,Event and Happening Design Award Category.
15,0.5239516188018095,Audio and Sound Equipment Design Award Category.
16,0.03813361767389283,Aerospace and Aircraft Design Award Category.
17,-0.05028388216624278,Design Quality and Innovation Award Category.
18,-0.06405110679608383,Kitchen Furniture, Equipment and Fixtures Design Award Category.
19,-0.12377612866315156,Toy, Games and Hobby Products Design Award Category.
20,-0.15520550055777593,Computers and Peripheral Devices Design Award Category.
21,-0.17071190588585203,Movie, Video and Animation Design Award Category.
22,-0.18143884531816132,Bathroom Furniture and Sanitary Ware Design Award Category.
23,-0.19649732210089024,Awards, Prize and Competitions Design Award Category.
24,-0.20009845558020153,Fashion, Apparel and Garment Design Award Category.
25,-0.2143903665508112,Architecture, Building and Structure Design Award Category.
26,-0.21657022391869066,Print and Published Media Design Award Category.
27,-0.2328377242739376,Graphics, Illustration and Visual Communication Design Award Category.
28,-0.24933482474185717,Limited Edition and Custom Design Award Category.
29,-0.2610821485846453,Interface and Interaction Design Award Category.
30,-0.26276638221295867,Safety Clothing and Personal Protective Equipment Design Award Category.
31,-0.2629321378962682,Sports, Entertainment and Recreation Equipment Design Award Category.
32,-0.2646368600850848,Meta, Strategic and Service Design Award Category.
33,-0.26703447016855875,Musical Instruments Design Award Category.
34,-0.2744000721795465,Packaging Design Award Category.
35,-0.2790152035061567,Building Materials and Construction Components Design Award Category.
36,-0.28322542269646744,Manufacturing and Processing Machinery Design Award Category.
37,-0.2860170107682693,Digital and Electronic Devices Design Award Category.
38,-0.30596661776336087,Fashion and Travel Accessories Design Award Category.
39,-0.3075994831824909,3D Printed Forms and Products Design Award Category.
40,-0.31672699840369495,Yacht and Marine Vessels Design Award Category.
41,-0.3447367901058254,Computer Graphics and 3D Model Design Award Category.
42,-0.34567187656613063,Baby, Kids' and Children's Products Design Award Category.
43,-0.3468715923266027,Lighting Products and Lighting Projects Design Award Category.
44,-0.3540527659719182,Medical Devices and Medical Equipment Design Award Category.
45,-0.3547835170756532,Street Furniture Design Award Category.
46,-0.3559677763480201,Education, Teaching Aid and Training Content Design Award Category.
47,-0.3640973766497396,Website and Web Design Award Category.
48,-0.36750242370609093,Art Materials, Stationery Supplies and Gift Items Design Award Category.
49,-0.36937689338882307,Wholesale, Retail Trade, Commerce and E-Commerce Design Award Category.
50,-0.37077353652255324,Pet Supplies and Products for Animals Design Award Category.
51,-0.37723816853197234,Mobile Technologies, Applications and Software Design Award Category.
52,-0.38235848614497975,Social Design Award Category.
53,-0.3836515233302133,Cultural Heritage and Culture Industry Design Award Category.
54,-0.39722602777793214,Arts, Crafts and Ready-Made Design Award Category.
55,-0.39853585481425413,Jewelry, Eyewear and Watch Design Award Category.
56,-0.4032646733241831,Furniture Design Award Category.
57,-0.4070955336810229,Garden and Outdoor Furniture Design Award Category.
58,-0.4141289521036541,Bakeware, Tableware, Drinkware and Cookware Design Award Category.
59,-0.421323503254915,Engineering and Technical Design Award Category.
60,-0.42197304969549243,Office Furniture Design Award Category.
61,-0.42382889035568816,Vehicle, Mobility and Transportation Design Award Category.
62,-0.4260625326310659,Photography and Photo Manipulation Design Award Category.
63,-0.4337874291706388,Agricultural Tools, Equipment and Machinery Design Award Category.
64,-0.4430425257877514,Differently Abled and Seniors' Assistance Design Award Category.
65,-0.4551849318666176,Advertising, Marketing and Communication Design Award Category.
66,-0.46479119109082934,Car and Land Based Motor Vehicles Design Award Category.
67,-0.47367989908926433,Security, Safety and Surveillance Products Design Award Category.
68,-0.47574032565579716,Public Awareness, Volunteerism, and Society Design Award Category.
69,-0.4801776420853407,Generative, Algorithmic and Parametric Design Award Category.
70,-0.48027233456063073,Sustainable Products, Projects and Green Design Award Category.
71,-0.48471870817850554,Outdoor Gear and Camping Equipment Design Award Category.
72,-0.4856880314083912,Cybernetics, Prosthesis and Implant Design Award Category.
73,-0.4856880314083912,Scientific Instruments and Research Equipment Design Award Category.
74,-0.4856880314083912,Camera and Photography Equipment Design Award Category.
75,-0.5127282127802553,Hospitality, Recreation, Travel and Tourism Design Award Category.
76,-0.5159994149951631,Home Appliances Design Award Category.
77,-0.5222470718191909,Food, Beverage and Culinary Arts Design Award Category.
78,-0.5434756043197005,Hardware, Power and Hand Tools Design Award Category.
79,-0.5545034828318525,Hospitality, Restaurant and Catering Products Design Award Category.
80,-0.5608013953166364,Wearable Technologies Design Award Category.
81,-0.599051367252208,Idea Design Award Category.
82,-0.6032605341111041,Furniture Accessories, Hardware and Materials Design Award Category.
83,-0.6052663929862812,Music, Audio and Sound Design Award Category.
84,-0.6486707095830824,Office and Business Appliances Design Award Category.
85,-0.6494398321802147,Textile, Fabric, Textures, Patterns and Cloth Design Award Category.
86,-0.6811247820062182,Footwear, Shoes and Boots Design Award Category.
87,-0.7007746366696065,Information Technologies Design Award Category.
88,nan,Digital and Broadcasting Media Design Award Category.
89,nan,Disposable and Single-Use Product Design Award Category.
90,nan,Engineering, Construction and Infrastructure Design Award Category.
91,nan,Heavy Machinery Design Award Category.
